{
  "$schema": "http://json-schema.org/draft-07/schema#",
  "$id": "https://example.com/user.schema.json",
  "title": "User",
  "description": "A user in the system",
  "type": "object",
  "required": ["id", "email", "name"],
  "properties": {
    "id": {
      "description": "The unique identifier for the user",
      "type": "integer",
      "minimum": 1
    },
    "email": {
      "description": "The user's email address",
      "type": "string",
      "format": "email"
    },
    "name": {
      "description": "The user's full name",
      "type": "string",
      "minLength": 1,
      "maxLength": 100
    },
    "age": {
      "description": "The user's age",
      "type": "integer",
      "minimum": 0,
      "maximum": 150
    },
    "roles": {
      "description": "The user's roles in the system",
      "type": "array",
      "items": {
        "type": "string",
        "enum": ["admin", "user", "moderator"]
      },
      "uniqueItems": true
    },
    "profile": {
      "description": "Additional profile information",
      "type": "object",
      "properties": {
        "bio": {
          "type": "string",
          "maxLength": 500
        },
        "website": {
          "type": "string",
          "format": "uri"
        },
        "location": {
          "type": "string",
          "maxLength": 100
        }
      },
      "additionalProperties": false
    },
    "createdAt": {
      "description": "When the user was created",
      "type": "string",
      "format": "date-time"
    },
    "updatedAt": {
      "description": "When the user was last updated",
      "type": "string",
      "format": "date-time"
    }
  },
  "additionalProperties": false,
  "examples": [
    {
      "id": 1,
      "email": "john.doe@example.com",
      "name": "John Doe",
      "age": 30,
      "roles": ["user"],
      "profile": {
        "bio": "Software developer passionate about open source",
        "website": "https://johndoe.dev",
        "location": "San Francisco, CA"
      },
      "createdAt": "2023-01-15T10:30:00Z",
      "updatedAt": "2023-12-01T14:22:30Z"
    }
  ]
}